{
  "$schema": "https://json-schema.org/draft/2020-12/schema",
  "$id": "https://tiny-rescue.local/schemas/mission.schema.json",
  "title": "Tiny Rescue mission",
  "type": "object",
  "additionalProperties": false,
  "required": [
    "id",
    "type",
    "locationId",
    "prerequisites",
    "scene",
    "steps",
    "reward",
    "localization",
    "assets"
  ],
  "properties": {
    "id": { "$ref": "#/$defs/id" },
    "type": { "enum": ["rescue", "help", "world"] },
    "locationId": { "$ref": "#/$defs/reference" },
    "subjectAnimalId": { "$ref": "#/$defs/reference" },
    "prerequisites": {
      "type": "array",
      "uniqueItems": true,
      "items": {
        "type": "object",
        "additionalProperties": false,
        "required": ["completedMissionId"],
        "properties": { "completedMissionId": { "$ref": "#/$defs/reference" } }
      }
    },
    "scene": {
      "type": "object",
      "additionalProperties": false,
      "required": ["background", "designWidth", "designHeight"],
      "properties": {
        "background": { "$ref": "#/$defs/path" },
        "designWidth": { "type": "integer", "const": 1024 },
        "designHeight": { "type": "integer", "const": 768 }
      }
    },
    "steps": {
      "type": "array",
      "minItems": 1,
      "maxItems": 4,
      "items": { "$ref": "#/$defs/step" }
    },
    "reward": {
      "type": "object",
      "additionalProperties": false,
      "required": ["completeMission"],
      "properties": {
        "completeMission": { "const": true },
        "unlockResidentId": { "$ref": "#/$defs/reference" },
        "worldFlags": {
          "type": "array",
          "uniqueItems": true,
          "items": { "$ref": "#/$defs/id" }
        }
      }
    },
    "localization": {
      "type": "object",
      "additionalProperties": false,
      "required": ["titleKey", "introKey", "successKey"],
      "properties": {
        "titleKey": { "type": "string", "minLength": 1 },
        "introKey": { "type": "string", "minLength": 1 },
        "successKey": { "type": "string", "minLength": 1 }
      }
    },
    "assets": {
      "type": "object",
      "additionalProperties": false,
      "required": ["required"],
      "properties": {
        "required": {
          "type": "array",
          "minItems": 1,
          "uniqueItems": true,
          "items": { "$ref": "#/$defs/path" }
        }
      }
    }
  },
  "$defs": {
    "id": { "type": "string", "pattern": "^[a-z0-9]+(?:-[a-z0-9]+)*$" },
    "reference": {
      "type": "string",
      "pattern": "^(?:[a-z0-9]+(?:-[a-z0-9]+)*:)?[a-z0-9]+(?:-[a-z0-9]+)*$"
    },
    "path": {
      "type": "string",
      "pattern": "^(?:[a-z0-9]+(?:-[a-z0-9]+)*:)?(?!/)(?!.*\\\\)(?!.*(?:^|/)\\.\\.?(?:/|$))(?!.*//)[a-z0-9][a-z0-9./-]*$"
    },
    "position": {
      "type": "object",
      "additionalProperties": false,
      "required": ["x", "y"],
      "properties": {
        "x": { "type": "number", "minimum": 0, "maximum": 1 },
        "y": { "type": "number", "minimum": 0, "maximum": 1 }
      }
    },
    "targetBounds": {
      "type": "object",
      "additionalProperties": false,
      "required": ["center", "height", "width"],
      "properties": {
        "center": { "$ref": "#/$defs/position" },
        "height": { "type": "number", "exclusiveMinimum": 0, "maximum": 1 },
        "width": { "type": "number", "exclusiveMinimum": 0, "maximum": 1 }
      }
    },
    "hint": {
      "type": "object",
      "additionalProperties": false,
      "required": ["type", "delayMs"],
      "properties": {
        "type": { "const": "pulse-after-delay" },
        "delayMs": { "type": "integer", "minimum": 1000, "maximum": 30000 }
      }
    },
    "successCue": {
      "enum": [
        "effects.interaction.tap-remove",
        "effects.interaction.obstacle-cleared",
        "effects.interaction.drag-snap",
        "effects.interaction.wipe-complete",
        "effects.interaction.match-success",
        "effects.interaction.trace-complete",
        "effects.progress.step-complete"
      ]
    },
    "baseStep": {
      "type": "object",
      "required": ["id", "type", "promptKey"],
      "properties": {
        "id": { "$ref": "#/$defs/id" },
        "type": { "enum": ["tap", "drag", "wipe", "match", "trace"] },
        "promptKey": { "type": "string", "minLength": 1 }
      }
    },
    "step": {
      "oneOf": [
        {
          "allOf": [
            { "$ref": "#/$defs/baseStep" },
            {
              "type": "object",
              "additionalProperties": false,
              "required": ["id", "type", "promptKey", "successCue", "hint", "targetIds"],
              "properties": {
                "id": { "$ref": "#/$defs/id" },
                "type": { "const": "tap" },
                "promptKey": { "type": "string" },
                "successCue": { "$ref": "#/$defs/successCue" },
                "hint": { "$ref": "#/$defs/hint" },
                "targetIds": { "type": "array", "minItems": 1, "items": { "$ref": "#/$defs/id" } }
              }
            }
          ]
        },
        {
          "allOf": [
            { "$ref": "#/$defs/baseStep" },
            {
              "type": "object",
              "additionalProperties": false,
              "required": [
                "id",
                "type",
                "promptKey",
                "successCue",
                "hint",
                "sourceId",
                "sourcePosition",
                "targetId",
                "targetBounds",
                "fallbackTargetBounds",
                "snapTolerance"
              ],
              "properties": {
                "id": { "$ref": "#/$defs/id" },
                "type": { "const": "drag" },
                "promptKey": { "type": "string" },
                "successCue": { "$ref": "#/$defs/successCue" },
                "hint": { "$ref": "#/$defs/hint" },
                "sourceId": { "$ref": "#/$defs/id" },
                "sourceAsset": { "$ref": "#/$defs/path" },
                "sourcePosition": { "$ref": "#/$defs/position" },
                "targetId": { "$ref": "#/$defs/id" },
                "targetBounds": { "$ref": "#/$defs/targetBounds" },
                "fallbackTargetBounds": { "$ref": "#/$defs/targetBounds" },
                "snapTolerance": { "type": "number", "minimum": 0.1, "maximum": 1 }
              }
            }
          ]
        },
        {
          "allOf": [
            { "$ref": "#/$defs/baseStep" },
            {
              "type": "object",
              "additionalProperties": false,
              "required": [
                "id",
                "type",
                "promptKey",
                "successCue",
                "hint",
                "maskId",
                "completionRatio"
              ],
              "properties": {
                "id": { "$ref": "#/$defs/id" },
                "type": { "const": "wipe" },
                "promptKey": { "type": "string" },
                "successCue": { "$ref": "#/$defs/successCue" },
                "hint": { "$ref": "#/$defs/hint" },
                "maskId": { "$ref": "#/$defs/id" },
                "completionRatio": { "type": "number", "minimum": 0.5, "maximum": 0.85 }
              }
            }
          ]
        },
        {
          "allOf": [
            { "$ref": "#/$defs/baseStep" },
            {
              "type": "object",
              "additionalProperties": false,
              "required": ["id", "type", "promptKey", "successCue", "hint", "pairs"],
              "properties": {
                "id": { "$ref": "#/$defs/id" },
                "type": { "const": "match" },
                "promptKey": { "type": "string" },
                "successCue": { "$ref": "#/$defs/successCue" },
                "hint": { "$ref": "#/$defs/hint" },
                "pairs": {
                  "type": "array",
                  "minItems": 1,
                  "maxItems": 3,
                  "items": {
                    "type": "object",
                    "additionalProperties": false,
                    "required": ["sourceId", "targetId"],
                    "properties": {
                      "sourceId": { "$ref": "#/$defs/id" },
                      "targetId": { "$ref": "#/$defs/id" }
                    }
                  }
                }
              }
            }
          ]
        },
        {
          "allOf": [
            { "$ref": "#/$defs/baseStep" },
            {
              "type": "object",
              "additionalProperties": false,
              "required": [
                "id",
                "type",
                "promptKey",
                "successCue",
                "hint",
                "pathId",
                "corridorWidth"
              ],
              "properties": {
                "id": { "$ref": "#/$defs/id" },
                "type": { "const": "trace" },
                "promptKey": { "type": "string" },
                "successCue": { "$ref": "#/$defs/successCue" },
                "hint": { "$ref": "#/$defs/hint" },
                "pathId": { "$ref": "#/$defs/id" },
                "corridorWidth": { "type": "number", "minimum": 0.05, "maximum": 0.4 }
              }
            }
          ]
        }
      ]
    }
  }
}
