{
  "id": "garden-kitten-tree",
  "type": "rescue",
  "locationId": "garden",
  "subjectAnimalId": "mimi-kitten",
  "prerequisites": [],
  "scene": {
    "background": "images/missions/garden-kitten-tree/background.png",
    "designWidth": 1024,
    "designHeight": 768
  },
  "steps": [
    {
      "id": "place-ladder",
      "type": "drag",
      "promptKey": "mission.garden-kitten-tree.step.place-ladder",
      "successCue": "effects.interaction.drag-snap",
      "hint": { "type": "pulse-after-delay", "delayMs": 5000 },
      "sourceId": "ladder",
      "sourceAsset": "images/missions/garden-kitten-tree/ladder.png",
      "sourcePosition": { "x": 0.2, "y": 0.72 },
      "targetId": "tree-ladder-target",
      "targetBounds": {
        "center": { "x": 0.65, "y": 0.61 },
        "height": 0.42,
        "width": 0.24
      },
      "fallbackTargetBounds": {
        "center": { "x": 0.65, "y": 0.68 },
        "height": 0.42,
        "width": 0.24
      },
      "snapTolerance": 0.55
    },
    {
      "id": "help-mimi-down",
      "type": "tap",
      "promptKey": "mission.garden-kitten-tree.step.help-mimi-down",
      "successCue": "effects.interaction.tap-remove",
      "hint": { "type": "pulse-after-delay", "delayMs": 5000 },
      "targetIds": ["mimi"]
    }
  ],
  "reward": {
    "completeMission": true,
    "unlockResidentId": "mimi-kitten",
    "worldFlags": ["mimi-rescued"]
  },
  "localization": {
    "titleKey": "mission.garden-kitten-tree.title",
    "introKey": "mission.garden-kitten-tree.intro",
    "successKey": "mission.garden-kitten-tree.success"
  },
  "assets": {
    "required": [
      "images/missions/garden-kitten-tree/background.png",
      "images/missions/garden-kitten-tree/ladder.png",
      "images/residents/mimi/mission.png"
    ]
  }
}
